id,name,url,interval_minutes,min_payout,max_payout,has_ref_program,ref_payout_percent,comments,is_paused,created_at,updated_at,slug,meta_title,meta_description,meta_keywords,has_low_balance
1,BitVisits,http://www.bitvisits.com/?i=478,1,200,1000,1,50,,0,"2015-08-18 12:38:42","2016-02-03 23:00:05",bitvisits,"BitVisits - Welcome, earn free bitcoin by viewing websites. Click.Visi","With BitVisits you can earn free bitcoin daily by viewing our advertisers websites. Bitcoin advertising directly to bitcoin users. Start clicking and earning fr","bitcoin, surf, surfing, ptc, pts, earn, free bitcoins, free, bitpay, microwallet, faucetbox",0
2,"Moon Bitcoin",http://moonbit.co.in?ref=08d76823021c,0,50,3000,1,50,"Max payout based on 168 hours of accumulation.",0,"2015-08-18 12:38:44","2017-01-23 18:00:04",moon-bitcoin,"Moon Bitcoin - Free Bitcoin Faucet","Moon Bitcoin is a bitcoin faucet with a difference...YOU decide how often to claim! Instant and weekly payment options. 50% referral commission.","bitcoin, free bitcoin, faucet, bitcoin faucet, win bitcoin, get free bitcoins, win free bitcoins, mining, xapo, satoshi",0
11,"Alien Faucet",http://bitcoinaliens.com/faucet/?ref=4935,5,100,10000,1,25,,0,"2015-08-18 12:39:10","2016-09-20 08:00:10",alien-faucet,"Alien Faucet",,,0
22,Bitcoinker,http://bitcoinker.com/faucet?ref=6749123ce00c,15,100,1000,1,25,,0,"2015-08-18 12:39:59","2016-12-14 05:00:10",bitcoinker,"Bitcoinker - Faucet","Bitcoinker is a free bitcoin faucet where you can earn satoshi every 15 minutes. Instant Faucetbox and Xapo payouts. 25% referral commission.","bitcoin, free bitcoin, faucet, bitcoin faucet, win bitcoin, get free bitcoins, win free bitcoins",0
26,"BTC 4 You",http://btc4you.com/?ref=13vYNWKj3npQTYr7EJVBhcoVkwncEbDUvJ,30,50,50,1,25,,0,"2015-08-18 12:40:22","2015-12-13 04:03:15",btc-4-you,"Free Bitcoin Faucet ",,,0
27,CrocoCoin,http://crococoin.com/?Referrer=8429,30,100,1000000,1,10,,0,"2015-08-18 12:40:24","2016-11-22 20:00:16",crococoin,,,,0
31,777Bitco.in,http://777bitco.in/?Referrer=113358,60,791,79067367,1,50,,0,"2015-08-18 12:40:37","2017-01-25 16:01:04",777bitco-in,"777bitco.in  - free bitcoin faucet. Get free bitcoins",,,0
33,"Best Bitcoin Faucet",http://best-bitcoin-faucet.eu/?w=13vYNWKj3npQTYr7EJVBhcoVkwncEbDUvJ,60,100,100,1,50,,0,"2015-08-18 12:40:42","2015-08-18 12:40:42",best-bitcoin-faucet,"Best-Bitcoin-Faucet.eu | Best free bitcoin faucet","Best bitcoin faucet online with highest instant rewards! Get 1 full Bitcoin free in Bitcoin Cloud Lottery!","bitcoin faucet, bitcoin faucet list, free bitcoin, get free bitcoins",0
34,"Bitcoin Free Faucet",http://bitcoin-free-faucet.eu/index.php?w=13vYNWKj3npQTYr7EJVBhcoVkwncEbDUvJ,60,50,50,1,50,,0,"2015-08-18 12:40:44","2015-12-09 11:00:31",bitcoin-free-faucet,"Bitcoin-free-faucet.eu | Best free bitcoin faucet","Best bitcoin faucet online with highest instant rewards! Get 1 full Bitcoin free in our Lottery! Win Free Bitcoins instantly.","bitcoin faucet, bitcoin faucet list, free bitcoin, get free bitcoins, best free bitcoin",0
35,"Bitcoin Showers",http://bitcoinshowers.com/?r=13vYNWKj3npQTYr7EJVBhcoVkwncEbDUvJ,60,100,1000,1,35,,0,"2015-08-18 12:40:47","2016-12-02 18:00:29",bitcoin-showers,"Bitcoin Showers",,,0
42,DataFaucet,http://datafaucet.info/faucet,60,100,1000,0,0,,0,"2015-08-18 12:41:05","2016-11-18 10:00:18",datafaucet,"Home - Datafaucet","Datafaucet Absoutely free Bitcoins","datafaucet, faucet, free, bitcoins, satoshis, instant, payment, coinbase",0
44,"Free Bitcoin Faucet",http://free-bitcoin-faucet.eu/index.php?w=13vYNWKj3npQTYr7EJVBhcoVkwncEbDUvJ,60,50,300,1,50,,0,"2015-08-18 12:41:10","2015-12-09 11:00:34",free-bitcoin-faucet,"Free-Bitcoin-Faucet.eu | Best free bitcoin faucet","Best bitcoin faucet online with highest instant rewards! Get 1 full Bitcoin free in our Lottery! Win Free Bitcoins instantly.","bitcoin faucet, bitcoin faucet list, free bitcoin, get free bitcoins, best free bitcoin",0
48,GetFreeBitcoin,http://get-free-bitcoin.eu/index.php?w=13vYNWKj3npQTYr7EJVBhcoVkwncEbDUvJ,60,50,300,1,50,,0,"2015-08-18 12:41:19","2015-12-09 11:00:38",getfreebitcoin,"Get-Free-Bitcoin.eu | Best free bitcoin faucet","Best bitcoin faucet online with highest instant rewards! Get 1 full Bitcoin free in our Lottery! Win Free Bitcoins instantly.","bitcoin faucet, bitcoin faucet list, free bitcoin, get free bitcoins, best free bitcoin",0
58,TreeBitcoin,http://treebitcoin.com/?Referrer=6176,60,200,10000,1,10,"Min. ref percentage is 10%, max percentage is 50%.",0,"2015-08-18 12:41:52","2016-12-04 03:00:51",treebitcoin,"Grow up the Bitcoin tree and have a harvest!","Bitcoin faucet, mining bitcoin, how to make bitcoin, index bitcoin, Earn on Bitcoin",,0
63,"Bitcoin Faucet TK",http://bitcoinfaucet.tk/?ref=13vYNWKj3npQTYr7EJVBhcoVkwncEbDUvJ,180,67,67,1,10,,0,"2015-08-18 12:42:03","2016-09-08 17:00:28",bitcoin-faucet-tk,"Bitcoin Faucet TK","Free Bitcoins every day!","bitcoin, bitcoins, free, faucet",0
65,BitcoinFaucet.eu,http://bitcoin-faucet.eu/index.php?w=13vYNWKj3npQTYr7EJVBhcoVkwncEbDUvJ,240,85,50000,1,50,,0,"2015-08-18 12:42:07","2015-12-09 11:00:53",bitcoinfaucet-eu,"Bitcoin-faucet.eu | Best free bitcoin faucet","Come and get free bitcoins on most generous bitcoin faucet website! Best bitcoin faucet online with highest rewards!","bitcoin faucet, bitcoin faucet list, free bitcoin, get free bitcoins",0
68,"Omnibot's Faucet",http://faucet.omnibot2k.com/,1440,1,400,0,0,,0,"2015-08-18 12:42:12","2016-12-23 14:00:45",omnibot-s-faucet,"Omnibot's Faucet","Get free bitcoins instantly up to 1969 per day",,0
73,WaterBitcoin,http://waterbitco.in/?ref=13vYNWKj3npQTYr7EJVBhcoVkwncEbDUvJ,30,600,20000,1,15,,0,"2015-08-20 14:01:31","2016-10-30 09:00:33",waterbitcoin,"Water Bitcoin","WaterBitcoin gives 600 to 20,000 free satoshis every hour, and sometimes doubles payouts.","Bitcoins, Satoshis, Water Bitcoin, Free Bitcoins, Free Satoshis",0
95,"Play Bitcoin",http://playbitco.in/?ref=13vYNWKj3npQTYr7EJVBhcoVkwncEbDUvJ,10,300,450,1,15,,0,"2015-09-14 17:28:35","2016-10-30 09:00:41",play-bitcoin,"Play Bitcoin","Vote for the cutest animal and get 300 satoshi every 10 minutes. If your animal wins, you'll receive extra 150 satoshi at the end of the round.","Cute Animal Bitcoin, free satoshi, free bitcoins, get free bitcoins",0
110,CarBitcoin,http://carbitcoin.com/?r=9870,10,300,1250,1,21,,0,"2015-09-25 20:36:10","2015-09-25 20:36:10",carbitcoin,"FREE BITCOINS | CarBitcoin.com - choose your car - get free bitcoins!","Simple click button to get free bitcoins | CarBitcoin.com - choose your car - get free bitcoins!","free bitcoins, free btc, btc, bitcoins, satoshi, get free bitcoins, car bitcoin",0
124,"We Love Bitcoin",http://welovebtc.com/?ref=13vYNWKj3npQTYr7EJVBhcoVkwncEbDUvJ,60,500,10000,1,15,,0,"2015-10-17 17:53:18","2016-10-30 09:00:45",we-love-bitcoin,"We Love Bitcoin","Earn 500, 550, 600 or 10,000 satoshi every hour from We  Love Bitcoin. Pays to your FaucetBox account.","We Love Bitcoin, Bitcoins, Bitcoin Faucet, Free Bitcoins, Free Satoshis",0
130,"Mellow Ads",http://mellowads.com/faucet/?ref=B3CFF7E1B2E1,0,1000,100000,1,50,"Claim once a day, and help us get advertising credit!",0,"2015-10-17 22:58:44","2017-01-09 03:00:28",mellow-ads,"Mellow Ads - simple, bitcoin web advertising","Mellow Ads - simple, bitcoin web advertising. Register with us and use our faucet to earn free bitcoin ad credits!","Mellow Ads, Bitcoin Ads, Get Free Bitcoin, Bitcoins, Free Bitcoin Ad Credits",0
131,"Claim BTC",http://claimbtc.com/?utm_source=referral&utm_campaign=3d11611a8f,20,243,500,1,25,,0,"2015-10-22 16:37:04","2017-01-25 20:01:49",claim-btc,"ClaimBTC.com: Free bitcoin faucet with bonuses. Get free bitcoins now!","Earn free bitcoins, receive bonuses and get even more bitcoins completely FREE in out faucet! The more you claim, the more you get. Join now! ","Free Bitcoin, Claim BTC, Get Free Bitcoins, Bitcoin Faucet, Bitcoins, Free Bitcoin Faucet",0
135,"Bonus Bitcoin",http://bonusbitcoin.co/?ref=7D4AA5BF89F3/,15,200,5000,1,50,"Average of approx. 1138 satoshis per claim.",0,"2015-11-30 22:35:17","2017-01-23 18:00:35",bonus-bitcoin,"Bonus Bitcoin - free bitcoin faucet","Free bitcoin faucet. Receive up to 5,000 satoshi per claim every 15 minutes. Automatic 5% DAILY BONUS. Free withdrawals. 50% lifetime referral commission.","Bonus Bitcoin, Bitcoins, Get Free Bitcoins, Satoshis, Free Bitcoin Faucet",0
143,"Penta Faucet",http://www.pentafaucet.com/?r=13vYNWKj3npQTYr7EJVBhcoVkwncEbDUvJ,90,101,50000,1,10,,0,"2016-04-24 16:12:01","2017-01-07 15:57:19",penta-faucet,"Penta Faucet - Earn up to 50.000 satoshis per claim!","Clean and easy to use Faucet - earn up to 50.000 Satoshis every 90 minutes with 10% referral commission. Future reward increases soon!","Penta Faucet, FaucetHub.io, Satoshis, Free Bitcoins, Free Satoshis",0
154,BioBTC,http://biobtc.net/?ui=57466,20,500,10000,1,50,,0,"2016-07-31 19:39:24","2016-12-18 04:01:19",biobtc,"BioBTC - Get free bitcoins every 20 minutes!","In an hour's collected amount is from 500 satoshi and up to 10000 satoshi. Bonus is available every 20 minutes. Our faucet gives bitcoins absolutely for free!","Claim, BioBTC, btc, bitcoin, get free bitcoins, satoshi, кран, сатоши, биткоин, бесплатный биткоин, бесплатные сатоши, Faucet, био, bio, химия, частицы, монеты биткоин",0
162,"Bitcoin Expose",http://bitcoinexpose.com/bitcoins-faucet?r=13vYNWKj3npQTYr7EJVBhcoVkwncEbDUvJ,10,50,200,1,10,,0,"2017-01-07 14:46:34","2017-01-07 14:46:56",bitcoin-expose,"Bitcoins Faucet - Bitcoin Expose","You can use the faucet to gain a portion of a bitcoin every 10 minutes. The system gives away 50 - 200 satoshis every 10 minutes. 5% bonus after 15 days.","bitcoin, satoshis, Bitcoin Faucet, Bitcoin Expose, free bitcoins, free satoshis",0
163,"One Click Faucet",http://www.oneclickhere.com/?r=13vYNWKj3npQTYr7EJVBhcoVkwncEbDUvJ,15,50,200,1,10,,0,"2017-01-07 16:09:58","2017-01-07 16:09:58",one-click-faucet,"One Click Faucet Claim 50 - 100 - 200 Satoshi every 15 minutes","One Click Faucet - Get 200 satoshi every 15 minutes.","Satoshi, free Satoshi, earn Satoshies, earnings, earnings Satoshies, faucet, Satoshi faucet, get free Satoshies",0
164,FastBit,http://fastbit.xyz/13vYNWKj3npQTYr7EJVBhcoVkwncEbDUvJ/,10,75,100,1,25,,0,"2017-01-07 16:16:04","2017-01-07 16:16:04",fastbit,"FASTBIT - Your unlimited source of Bitcoin.","Get your free Bitcoin each 10 minutes.","bitcoin, satoshi, faucet",0
165,X-Faucet,http://x-faucet.xyz/?r=13vynwkj3npqtyr7ejvbhcovkwncebduvj,1,10,1000,1,50,,0,"2017-01-07 16:25:17","2017-01-18 08:00:39",x-faucet,"Free Bitcoin - you earn up to 1000 satoshis every minute!","X-Faucet, a source of bitcoins! Bitcoin faucet that gives you up to 1000 satoshis every minute. Share this faucet and get 50% referral commission!","Free bitcoin, bitcoin, bitcoins, faucet, bitcoin faucet, satoshi, FaucetBox, rewards, satoshis, free satoshis, 1000 satoshis, earn bitcoin, get free bitcoin, 50% referral commission, every minute, get satoshis, earn satoshis, crypto currency",0
166,Konstantinova,https://konstantinova.net/?r=13vYNWKj3npQTYr7EJVBhcoVkwncEbDUvJ,1,7,25,1,25,,0,"2017-01-07 16:34:35","2017-01-25 15:01:51",konstantinova,"Konstantinova: Get Free bitcoin now","Free Bitcoin Faucet. Rewards: 13 to 33 satoshi every time.","Bitcoin, BTC, Bitcoin faucet, Earning online, Earn bitcoin, Earn satoshi, Cryptocurrency",0
167,"Bitcoin Faucetdog",http://fausetdog.ru/?r=13vYNWKj3npQTYr7EJVBhcoVkwncEbDUvJ,5,1,100,1,10,,0,"2017-01-07 16:41:33","2017-01-07 16:41:33",bitcoin-faucetdog,"Bitcoin Faucetdog","Claim upto 100 Satoshi Every 5 Minutes","Bitcoin, faucetdog, satoshi, claim free bitcoin, bitcoins",0
168,"The BTC Faucet",https://thebtcfaucet.com/?r=13vYNWKj3npQTYr7EJVBhcoVkwncEbDUvJ,30,100,25000,1,25,,0,"2017-01-07 16:52:31","2017-01-22 11:00:35",the-btc-faucet,"The Bitcoin Faucet | Claim Free Bitcoin","The BTC Faucet is a simple, fast, and free Bitcoin faucet. Claim with a simple click, get lots of prizes, bonuses and loyalty rewards. Join now!","FaucetHub.io, Satoshis, Free Bitcoins, Free Satoshis, The BTC Faucet, Satoshi, Bitcoin",0
169,Fautsy,http://www.fautsy.com/?r=13vYNWKj3npQTYr7EJVBhcoVkwncEbDUvJ,1,15,30,1,25,,0,"2017-01-12 21:01:42","2017-01-12 21:01:42",fautsy,"Fautsy - Claim 15-30 Satoshi Every Second","Fautsy - Claim 15-30 Satoshi Every Second. Referral commission is 25%, payout via FaucetHub.","Fautsy, Bitcoin, Satoshi, Get Free Bitcoins, FaucetHub",0
170,"Get Your Bitcoin",http://getyourbitco.in/413775,5,150,200,1,25,,0,"2017-01-15 21:23:48","2017-01-15 21:23:48",get-your-bitcoin,"Get Your Bitco.in - Get 200 satoshi every 5 minutes.","Earn Satoshi every 5 minutes.","Satoshi, free Satoshi, earn Satoshies, earnings, earnings Satoshies, faucet, Satoshi faucet, get free Satoshies",0
171,PayMyClic,http://pay.paymysearch.com/?r=13vYNWKj3npQTYr7EJVBhcoVkwncEbDUvJ,60,221,9600,1,5,"26-220 (99.8%), 221-800 (1%), 801-2800 (0.1%), 2801-9600 (< 0.1%) satoshi every 60 minutes.",0,"2017-01-16 19:07:41","2017-01-16 19:07:41",paymyclic,"PayMyClic Up To 9600 x Hr.","Get up to 9600 satoshis per hour, and get paid in BTC to search! 26-220 (99.8%), 221-800 (1%), 801-2800 (0.1%), 2801-9600 (< 0.1%) satoshi every 60 minutes.","PayMyClic, Satoshi, BTC, satoshis, paid to search, bitcoin search",0
172,IFaucet,http://ifaucet.net/?ref=9182,1,1,60000,1,100,,0,"2017-01-16 20:15:29","2017-01-16 20:15:29",ifaucet,"Biggest free Bitcoin / Dogecoin / Litecoin / DASH faucets list","Biggest free Bitcoin / Dogecoin / Litecoin / DASH faucets list in the world","Bitcoin, make bitcoin, free, list, Big faucet collection, faucet, collection, wallet, earn, earning bitcoin, free, bitcoin faucets, satoshi, Dogecoin, Litecoin, BTC, LTC, DXG, Doge, rotator",0
173,BitcoBear,https://bitcobear.com/?r=13vYNWKj3npQTYr7EJVBhcoVkwncEbDUvJ,60,100,250,1,20,,0,"2017-01-16 20:25:40","2017-01-16 20:25:40",bitcobear,BitcoBear,"BitcoBear wants to give you loads and loads of free satoshis. But hurry before the bear gets them all!","BitcoBear, Bear, satoshis, Bitcoin, get free bitcoins",0
174,BitcoBear2,https://bitcobear.com/faucet_2/?r=13vYNWKj3npQTYr7EJVBhcoVkwncEbDUvJ,10,10,250,1,20,,0,"2017-01-16 20:29:05","2017-01-16 20:29:05",bitcobear2,BitcoBear2,"BitcoBear2 wants to give you loads and loads of free satoshis. But hurry before the bear gets them all!","BitcoBear2, Bear, satoshis, Bitcoin, get free bitcoins",0
175,BitcoBear3,https://bitcobear.com/faucet_3/?r=13vYNWKj3npQTYr7EJVBhcoVkwncEbDUvJ,10,10,250,1,20,,0,"2017-01-16 20:31:21","2017-01-16 20:31:21",bitcobear3,BitcoBear3,"BitcoBear3 wants to give you loads and loads of free satoshis. But hurry before the bear gets them all!","BitcoBear3, Bear, satoshis, Bitcoin, get free bitcoins",0
176,BitcoBear4,https://bitcobear.com/faucet_4/?r=13vYNWKj3npQTYr7EJVBhcoVkwncEbDUvJ,10,10,250,1,20,,0,"2017-01-16 20:33:53","2017-01-16 20:33:53",bitcobear4,BitcoBear4,"BitcoBear4 wants to give you loads and loads of free satoshis. But hurry before the bear gets them all!","BitcoBear4, Bear, satoshis, Bitcoin, get free bitcoins",0
177,BitcoBear5,https://bitcobear.com/faucet_5/?r=13vYNWKj3npQTYr7EJVBhcoVkwncEbDUvJ,10,10,250,1,20,,0,"2017-01-16 20:36:01","2017-01-16 20:36:01",bitcobear5,BitcoBear5,"BitcoBear5 wants to give you loads and loads of free satoshis. But hurry before the bear gets them all!","BitcoBear5, Bear, satoshis, Bitcoin, get free bitcoins",0
178,Chronox,http://chronox.co.in/283115,5,12,426,1,10,,0,"2017-01-16 20:43:38","2017-01-16 20:43:38",chronox,"ChronoX.co.in - Get free bitcoins every 5 minutes","ChronoX.co.in - Get free bitcoins every 5 minutes","bitcoin, BTC, free bitcoin, earn bitcoins, earnings, earnings Bitcoins, faucet, bitcoin faucet, get free bitcoin",0
179,"Time for Bitco",http://timeforbitco.in/261041,5,55,55,1,10,,0,"2017-01-16 21:00:04","2017-01-16 21:00:04",time-for-bitco,"Time for Bitco - Get free Satoshi every 5 minutes.","Time for Bitco - Get free Satoshi every 5 minutes.","free Satoshi, earn Satoshies, earnings, earnings Satoshies, faucet, Satoshi faucet, get free Satoshies",0
180,BustedFaucet,http://www.bustedfaucet.com/?r=13vYNWKj3npQTYr7EJVBhcoVkwncEbDUvJ,5,100,1000,1,10,,0,"2017-01-17 16:40:59","2017-01-17 16:40:59",bustedfaucet,"BustedFaucet - Free Bitcoin Faucet!","Welcome to BustedFaucet. BustedFaucet is a free bitcoin faucet, which offers anywhere from 100 to 1000 satoshis. You are able to claim every 5 minutes.","Busted Faucet, satoshis, claim free bitcoin, claim free satoshis, free bitcoin faucet",0
181,Free4Faucet,http://www.free4faucet.com/?uniq=108983810357c1528fdf3e6,15,100,800,1,50,,0,"2017-01-17 19:21:42","2017-01-17 19:21:42",free4faucet,"Grow your business, expand your site or earn bitcoin - Free4faucet","Earn bitcoin from claiming on faucets and collecting bonuses!","Free bitcoin, free rotator, create a rotator, earn bitcoin, faucet link builder, bitcoin offers, bitcoin surveys, bitcoin videos",0
182,"Earn Free Bitcoins",https://earnfreebitcoins.net/?ref=167726,0,1000,3000,1,25,,0,"2017-01-17 20:01:50","2017-01-17 20:01:50",earn-free-bitcoins,"Earn Free Bitcoins - The Highest Paying Bitcoin Faucet","Earn Free Bitcoins offers you the opportunity to earn free bitcoins, earn now just by clicking a button! High security and support are our core, join now.","EarnFreeBitcoins, Bitcoin Faucet, Earn Bitcoins, Earn Satoshi, free bitcoin, free satoshi, free bitcoins, free bitcoin, bitcoin free, bitcoin faucet, get free bitcoins, earn free bitcoins, earn",0
183,Kiixa,http://kiixa.com/?r=admin@freebtc.website,1,50,50,1,50,,1,"2017-01-18 18:18:43","2017-01-25 05:03:08",kiixa,"Kiixa Xapo Faucet","Free Bitcoin every minute + 50% Referral Commission - instant payments of 50 satoshis every minute!","Kiixa, Xapo, Faucet, Bitcoin, Free Bitcoin, Satoshis, free bitcoin every minute",0
184,"BTCLeak Bitcoin Faucet",http://btcleak.com/?r=13vYNWKj3npQTYr7EJVBhcoVkwncEbDUvJ#FreeBtc,60,50,500,1,25,,0,"2017-01-21 21:01:09","2017-01-23 08:01:10",btcleak-bitcoin-faucet,"BTCLeaks | Bitcoin Website","Welcome to BTCLeak Bitcoin Faucet! Claim up to 500 satoshi every 60 minutes, promote BTCLeak and earn 25% referral commission. Claim now!","BTCLeak, bitcoin, BTC, free bitcoin, earn bitcoins, earnings, earnings Bitcoins, faucet, bitcoin faucet, get free bitcoin",0
